video_id,trending_date,title,channel_title,category_id,publish_time,tags,views,likes,dislikes,comment_count,thumbnail_link,comments_disabled,ratings_disabled,video_error_or_removed,description
7779JdxVAg0,17.14.11,"10 FILMS que LES PARENTS CROYAIENT ÊTRE pour ENFANTS, ALORS que NON | Lama Faché",Lama Faché,24,2017-11-12T15:59:38.000Z,"dessin animé|""disney""|""top 10""|""top 5""|""top10""|""listes""|""lama faché""|""films""|""cinéma""|""acteur""|""incroyable""|""bande annonce""|""nouveau film""|""seance cinema""|""curiosité""|""10 plus""|""tendances""|""faits""|""videos droles""",653398,27773,2778,3976,https://i.ytimg.com/vi/7779JdxVAg0/default.jpg,FALSE,FALSE,FALSE,"Si vous pensiez que tous les films pour enfants étaient forcement à 100% adaptés aux enfants de tous âges, eh ben je peux vous garantir que certains parents un peu partout dans le monde ne sont absolument pas d’accord avec vous. Installez vous confortablement voici I0 films que les parents croyaient être pour enfants, alors que non\n.\nN’oublie pas de t’abonner à la chaîne : https://goo.gl/KOb7Ns\n.\nFB : https://www.facebook.com/lamafachetv/\n.\nFor copyright matters please send an email to : contactlamatv@gmail.com"
jVpp2BUtMoY,17.14.11,So We Started A Fire...,Philly D,22,2017-11-13T17:00:04.000Z,"PhillyD|""Philly D""|""Vloggity""|""The Philip DeFranco Show""|""Philip DeFranco Show""|""DeFrancoElite""|""Vlog""|""Vlogger""|""Docuvlog""|""DeFranco Elite""|""YouTube""|""World Kindness Day""|""Respect""|""Polite""|""Giving""|""Conversation""|""kind""|""therapy""|""all the feels""|""face to face""|""kindness day""|""worst""|""worldkindnessday""|""body shaming""|""cheating""|""fatphobia""|""annoying""|""personality traits""|""body positivity""|""fat shaming""|""dogs""|""dog lover""|""feel good news""|""you are not alone""|""burning effigy""|""giving back""|""share the love""|""spread the love""",92280,11045,182,1412,https://i.ytimg.com/vi/jVpp2BUtMoY/default.jpg,FALSE,FALSE,FALSE,"Happy World Kindness Day! Call that family member, text that friend, buy that coworkers lunch. Do something for someone else today, you never know who might need some kindness in their life.  \n\nSupport what we're making: http://DeFrancoElite.com\nThe Latest PDS: https://youtu.be/iSexsVbz554\nTheDeFrancoFam: https://youtu.be/_OUiaSE7pHI\n\nWanna say hello? Tell us what you thought?\nDani R - https://twitter.com/GrownWomanChild \nKristy P - https://twitter.com/KristyyLovee \n\nAmanda M - https://twitter.com/MandaOhDang \nBrian B - https://twitter.com/brianjborst\n\nJames G - https://twitter.com/jamesgirardier \nKeith B - https://twitter.com/KeithWOaCrew \n\nZack T - https://twitter.com/zacktaylor_92 \nBriana D - https://twitter.com/Brianadunc \n\n————————————\nFollow Me On Social!\n————————————\nFACEBOOK: http://on.fb.me/mqpRW7\nTWITTER: http://Twitter.com/PhillyD\nINSTAGRAM: https://instagram.com/phillydefranco/\nSNAPCHAT: TheDeFrancoFam\nREDDIT: https://www.reddit.com/r/DeFranco\nITUNES: http://DeFrancoMistakes.com\nSOUNDCLOUD: http://letsmakemistakestogether.com\nGOOGLE PLAY: http://mistakeswithdefranco.com\n\nEdited by Keith Battista: http://twitter.com/KeithWOaCrew\n\nP.O. BOX\nAttn: Philip DeFranco\n16350 Ventura Blvd\nSuite D #542\nEncino, CA 91436\n\nSome music by David Cutter: http://davidcuttermusic.co.uk"
j67FgNEvyh8,17.14.11,Telefoon || Babbu Maan || Promo || Full Song 15th November || Latest Punjabi Songs 2017 || Hey Yolo,Hey Yolo,10,2017-11-12T04:24:34.000Z,"Telefoon|""Babbu Maan""|""Mehfil Mitran Di""|""new punjabi songs""|""The Babbu Maan Store""|""Hey Yolo""|""Swag Music""|""Latest Punjabi Songs 2017""|""Latest Punjabi Songs""|""new punjabi songs 2017""|""punjabi music""|""punjabi music 2017""|""punjabi latest songs""|""punjabi movies 2017""|""punjabi movies songs 2017""|""punjabi""|""punjabi songs 2017 latest""|""punjabi songs 2017 babbu maan""|""Delhi To Lahore""|""Babbu Maan Live""|""Babbu Maan Online""|""Samundar Babbu Maan""|""happy diwali""|""chandigarh""|""punjab""|""mohali""|""maan saab""|""canada""",178447,4339,96,876,https://i.ytimg.com/vi/j67FgNEvyh8/default.jpg,FALSE,FALSE,FALSE,"Full Song Out Now 15th November\n\nHey Yolo, Swag Music & Munish Sharma Presents\nhttps://www.facebook.com/heyyolomusic\n\nSong - Telefoon\n\nSinger - Babbu Maan\n\nMusic - Babbu Maan\n\nLyrics - Babbu Maan\n\nDirected & Concept  - Babbu Maan\n\nLabel - Hey Yolo & Swag Music\n\nProduced By - Munish Sharma\nhttps://www.facebook.com/Munish-Sharma-776830345813791\nhttps://www.instagram.com/OfficialMunishSharma\n\nD.O.P - Inder Sohi\n\nLike || Comment || Share"
oQH_rtoHsdQ,17.14.11,CARPOOL KARAOKE w/ FaZe Banks!!,FaZe Adapt,22,2017-11-12T00:40:37.000Z,"Adapt|""FaZeClan""|""FaZe Gaming""|""carpool karaoke""|""faze banks""|""faze adapt""|""romvn""",585425,36207,1288,3002,https://i.ytimg.com/vi/oQH_rtoHsdQ/default.jpg,FALSE,FALSE,FALSE,"100,000 LIKES FOR PART 2!!\n👉 SUBSCRIBE ► http://bit.ly/SubAdapt \n► Twitter: https://twitter.com/FaZeAdapt\n► Instagram: http://instagr.am/TheFaZeAdapt\n\nBANKS: https://youtube.com/Bankshasbank\nROMVN: https://twitter.com/The_Romvn\n\n10% Gamma Labs Discount Code ADAPT\nhttp://www.gfuel.com/#\n\n5% Scuf Discount Code ADAPT\nhttp://scufgaming.com/\n\nfamily friendly pg clean"
m-nZmgHWoEw,17.14.11,Mythical Dog Party,Good Mythical MORE,24,2017-11-13T11:00:06.000Z,"rhett and link|""good mythical more""|""rhett and link good mythical more""|""good mythical more rhett and link""|""season 12""|""mythical dog party""|""mythical crew""|""rhett""|""link""|""gmm""|""gmmore""|""gmm crew""|""rhett link dog""|""rhett link dogs""|""dogs""|""party""|""mythical""|""nickelback""|""nickelback rockstar""|""nickelback photograph""|""nickelback how you remind me""|""nickelback songs""|""rescue dog""|""rescue dogs""|""adopted dog""|""adopted dogs""|""cute dog""|""cute dogs""|""dog""",116676,4324,136,618,https://i.ytimg.com/vi/m-nZmgHWoEw/default.jpg,FALSE,FALSE,FALSE,We're hanging with some of the dogs of the Mythical Crew & forcing the Lyrical Loser to endure as much Nickelback as they can stand. \nWatch today's GMM: http://bit.ly/GMM1218 | Watch a previous GMM: http://bit.ly/GMM1217 \n\nPick up all of the official GMM merch only at https://mythical.store\n\nFollow Rhett & Link: \nInstagram: https://instagram.com/rhettandlink\nFacebook: https://facebook.com/rhettandlink\nTwitter: https://twitter.com/rhettandlink\nTumblr: https://rhettandlink.tumblr.com\nSnapchat: @realrhettlink\nWebsite: https://mythical.co\n\nCheck Out Our Other Mythical Channels:\nGood Mythical Morning: https://youtube.com/goodmythicalmorning\nRhett & Link: https://youtube.com/rhettandlink\nThis Is Mythical: https://youtube.com/thisismythical\nEar Biscuits: https://applepodcasts.com/earbiscuits\n\nWant to send us something? https://mythical.co/contact\nHave you made a Whee of Mythicality intro video? Submit it here: https://bit.ly/GMMWheelIntro\n\nIntro Animation by Digital Twigs: https://www.digitaltwigs.com\nIntro & Outro Music by Jeff Zeigler & Sarah Schimeneck https://www.jeffzeigler.com\nWheel of Mythicality theme: https://www.royaltyfreemusiclibrary.com/\nAll Supplemental Music fromOpus 1 Music: https://opus1.sourceaudio.com/\nWe use ‘The Mouse’ by Blue Microphones https://www.bluemic.com/mouse/
V4Uuxg6jmbo,17.14.11,The Try Guys Bake Bread Without A Recipe,BuzzFeedVideo,22,2017-11-11T16:00:37.000Z,"try|""guys""|""keith""|""ned""|""zach""|""eugene""|""baking""|""great""|""british""|""competition""|""parody""|""cooking""|""bread""|""food""|""show""|""recipe""|""loaf""|""funny""|""buzzfeed""|""video""|""clark""|""street""|""english""|""mary""|""paul hollywood""|""flour""|""yeast""|""dough""|""bake""",3597410,128127,1756,10370,https://i.ytimg.com/vi/V4Uuxg6jmbo/default.jpg,FALSE,FALSE,FALSE,"It's The Great Try Guys Bake-Off!\n\nCredits: https://www.buzzfeed.com/bfmp/videos/25896\n\nCheck out more awesome videos at BuzzFeedVideo!\nhttps://bit.ly/YTbuzzfeedvideo\nhttps://bit.ly/YTbuzzfeedblue1\nhttps://bit.ly/YTbuzzfeedviolet\n\nGET MORE BUZZFEED:\nhttps://www.buzzfeed.com\nhttps://www.buzzfeed.com/videos\nhttps://www.youtube.com/buzzfeedvideo\nhttps://www.youtube.com/boldly\nhttps://www.youtube.com/buzzfeedblue\nhttps://www.youtube.com/buzzfeedviolet\nhttps://www.youtube.com/perolike\nhttps://www.youtube.com/ladylike\n\nBuzzFeedVideo\nBuzzFeed Motion Picture’s flagship channel. Sometimes funny, sometimes serious, always shareable. New videos posted daily!\n\nMUSIC\nLicensed via Audio Network\nThe Throb_main\nLicensed via Warner Chappell Production Music Inc.\nTuba Time\nLicensed via Warner Chappell Production Music Inc.\nGet The Funny Thief_fullmix\nLicensed via Warner Chappell Production Music Inc.\nCE Der Kommisar_fullmix\nLicensed via Warner Chappell Production Music Inc.\nSecrets In The Closet_fullmix\nLicensed via Warner Chappell Production Music Inc.\nFamily Gossip_fullmix\nLicensed via Warner Chappell Production Music Inc.\nSell Your Granny_fullmix\nLicensed via Warner Chappell Production Music Inc.\nLittle Tinker\nLicensed via Warner Chappell Production Music Inc.\nPizzi Risky_fullmix\nLicensed via Warner Chappell Production Music Inc.\nStar Waltz Fairytale_fullmix\nLicensed via Warner Chappell Production Music Inc.\nCooking Attempts_fullmix\nLicensed via Warner Chappell Production Music Inc.\nMountain Climber_fullmix\nLicensed via Warner Chappell Production Music Inc.\nMove The House_fullmix\nLicensed via Warner Chappell Production Music Inc.\nOur Neighbours_fullmix\nLicensed via Warner Chappell Production Music Inc.\nGirls Time_fullmix\nLicensed via Warner Chappell Production Music Inc.\nKitchen Talk_fullmix\nLicensed via Warner Chappell Production Music Inc.\nStrawberry Ice_fullmix\nLicensed via Warner Chappell Production Music Inc.\nCE Frozen Time_fullmix\nLicensed via Warner Chappell Production Music Inc.\nA Classical Drama_Full\nLicensed via Warner Chappell Production Music Inc.\nHotels And Motels_Full\nLicensed via Warner Chappell Production Music Inc.\nPrima Donna_FullMix\nLicensed via Warner Chappell Production Music Inc.\nCarriages and Castles_FullMix\nLicensed via Warner Chappell Production Music Inc.\nScattered Light_FullMix\nLicensed via Warner Chappell Production Music Inc.\nWinter Palace_FullMix\nLicensed via Warner Chappell Production Music Inc.\nStar Waltz Fairytale_fullmix (1)\nLicensed via Warner Chappell Production Music Inc.\nA Cheerful Motion_Full\nLicensed via Warner Chappell Production Music Inc.\nFizzicato_FullMix\nLicensed via Warner Chappell Production Music Inc.\nA Quirky Episode_Full\nLicensed via Warner Chappell Production Music Inc.\nComedy Of Errors_Full\nLicensed via Warner Chappell Production Music Inc.\nClap With Me_Main\nLicensed via Warner Chappell Production Music Inc.\n\nSTILLS\nTypes of healthy bakery foods. Croissant and fresh bread. Hand drawn vector pictures\nONYXprj/Getty Images\n\nVIDEO\nLong eared Anglo Nubian baby goats\nphotosoup/Getty Images\nLamb prancing alongside her mother\nsiur/Getty Images\nCLOSE UP: Cute fluffy light brown baby bunny eating big fresh carrot \nhelivideo/Getty Images\nClose up time lapse loaf of bread baking and turning brown in oven\nThe Time Lapse Company/Getty Images\nHD Motion Time-Lapse: Sunrise Cloudscape Over Wheat Field\nSimonSkafar/Getty Images\nPreparation of the puff dough in bakery\npro100pasha/Getty Images\nAgriculture - Man's hand touching wheat.\nsircco/Getty Images\nExtreme close up knife slicing loaf of crusty bread\nMr. Big Film/Getty Images\nDeer grazing and walking\nBlimp Tele Inc/Getty Images\nBaby Goat Playing and Bleating\nBluntr /Getty Images\n\n\nEXTERNAL CREDITS\nZack Hall\nhttp://clarkstreetbakery.com/\n\n\nCredits: https://www.buzzfeed.com/bfmp/videos/25896\n\nCheck out more awesome videos at BuzzFeedVideo!\nhttps://bit.ly/YTbuzzfeedvideo\nhttps://bit.ly/YTbuzzfeedblue1\nhttps://bit.ly/YTbuzzfeedviolet\n\nGET MORE BUZZFEED:\nhttps://www.buzzfeed.com\nhttps://www.buzzfeed.com/videos\nhttps://www.youtube.com/buzzfeedvideo\nhttps://"
WuTFI5qftCE,17.14.11,PAPY GRENIER - METAL GEAR SOLID,Joueur Du Grenier,20,2017-11-12T17:00:02.000Z,"Papy grenier|""Metal Gear Solid""|""PS1""|""Tirage d'oreille""|""Humour""|""retro Gaming""|""Joueur du Grenier""|""JDG""",925222,85016,550,4303,https://i.ytimg.com/vi/WuTFI5qftCE/default.jpg,FALSE,FALSE,FALSE,"Nouvel ,épisode de Papy Grenier ! Ce mois-ci on part du coté de METAL GEAR SOLID ! N'hésitez pas à partager si vous avez aimé, ca nous aide ^^ Bisous et rdv dans 1 mois !"
_A5Z00E5gx8,17.14.11,急诊科医生 | Emergency Physician 25（张嘉译、王珞丹、柯蓝等主演）,麻辣变形计 HOT GIRL,22,2017-11-12T16:00:02.000Z,"马克|""迪丽热巴""|""麻辣变形计""|""军旅""|""美女""|""感情""|""都市""|""电视剧""|""热播""|""火辣""|""女军""|""制服""|""张嘉译""|""王珞丹""|""江珊""|""柯蓝""|""巩峥""|""zhangjiayi""|""wangluodan""|""jiangshan""|""kelan""|""kongzheng""",123778,82,20,64,https://i.ytimg.com/vi/_A5Z00E5gx8/default.jpg,FALSE,FALSE,FALSE,【欢迎订阅本频道】\n\n该剧讲述了急诊科主任医生何建一与海归医生江晓琪从一开始的互相审视，到互相理解、渐生情愫，并携手克服种种困难，救治患者，救赎自我的故事。
wczm1faUZ1Q,17.14.11,Barnicle: World Leaders Are Laughing At The US | Morning Joe | MSNBC,MSNBC,25,2017-11-13T14:53:22.000Z,"Morning Joe|""Joe Scarborough""|""Mika Brzezinski""|""Willie Geist""|""MSNBC""|""MSNBC news""|""MSNBC live""|""MSNBC TV""|""news""|""breaking news""|""current events""|""US news""|""politics""|""politics news""|""political news""|""elections""|""president trump putin comments""|""president vladimir putin""|""russia meddling""|""vladimir putin""|""putin""|""president trump""|""trump in asia""|""trump in vietnam""|""apec 2017""|""russian""|""president putin""|""trump asia trip""|""election 2016""|""election hacking""",200264,2947,317,2321,https://i.ytimg.com/vi/wczm1faUZ1Q/default.jpg,FALSE,FALSE,FALSE,"Over the weekend, President Trump raised eyebrows when he stated he believed Russian President Vladimir Putin's assertions that Russia didn't meddle in the 2016 election, which Trump later corrected.\n» Subscribe to MSNBC: http://on.msnbc.com/SubscribeTomsnbc\n\nAbout: MSNBC is the premier destination for in-depth analysis of daily headlines, insightful political commentary and informed perspectives. Reaching more than 95 million households worldwide, MSNBC offers a full schedule of live news coverage, political opinions and award-winning documentary programming -- 24 hours a day, 7 days a week.\n\nConnect with MSNBC Online\nVisit msnbc.com: http://on.msnbc.com/Readmsnbc\nFind MSNBC on Facebook: http://on.msnbc.com/Likemsnbc\nFollow MSNBC on Twitter: http://on.msnbc.com/Followmsnbc\nFollow MSNBC on Google+: http://on.msnbc.com/Plusmsnbc\nFollow MSNBC on Instagram: http://on.msnbc.com/Instamsnbc\nFollow MSNBC on Tumblr: http://on.msnbc.com/LeanWithmsnbc\n\nBarnicle: World Leaders Are Laughing At The US | Morning Joe | MSNBC"
uEu5--lyNCE,17.14.11,Cats Hate Pregnant - Off Topic #102,Achievement Hunter,20,2017-11-12T18:00:03.000Z,"Achievement Hunter|""AH""|""video game""|""gaming""|""game""|""gameplay""|""game play""|""michael jones""|""ryan haywood""|""lindsay jones""|""gavin free""|""jeremy dooley""|""jack pattillo""|""extra life""|""movies""|""comedy""|""funny""|""cats""|""babies""|""million dollars but""|""jeff goldblum""|""thor ragnarok""|""justice league""|""xbox one x""|""sky factory""|""samuel jackson""|""spider man homecoming""|""ready player one""|""fuel""|""git gud""|""action league now""|""daria""|""cuphead""|""lion king""|""james buckley""|""alan ritchson""|""off topic""|""podcast""|""last call""|""bar""",191353,3307,85,534,https://i.ytimg.com/vi/uEu5--lyNCE/default.jpg,FALSE,FALSE,FALSE,"The AH Crew sit down to talk about Jeremy’s bad morning, baby sounds, Extra Life and more on this week's Off Topic! Join FIRST to watch episodes early: http://bit.ly/2eHXQn0\n\nThis episode originally aired November 10, 2017 and is sponsored by Beachbody on Demand (http://bit.ly/2wekldC) and the Rooster Teeth Store (http://bit.ly/2dJMiSK)\n\n» Get your Achievement Hunter merch: http://bit.ly/2wqFb6V\n» Subscribe: http://bit.ly/AHYTChannel\n\nAbout Achievement Hunter:\nHello fellow Gamer. This you should watch me. I play game. Good. Thank you, thank you. If you watch me, I'm hot. Videos, they'll be better... The Achievement Hunter view is the right thing to do YouTube, so do.\n\nMore from Achievement Hunter:\n» Let's Play: http://bit.ly/1BuRgl1 \n» Rooster Teeth: http://bit.ly/13y3Gum\n\nhttps://www.youtube.com/user/achievementhunter"
cTBnDJ77kr0,17.14.11,H3 Podcast #38 - Hila Klein,H3 Podcast,24,2017-11-11T19:38:28.000Z,"hila|""klein""|""hila klein""|""hila kleiner""|""hila klein from h3h3""|""h3h3""|""h3h3productions""|""h3 podcast""|""podcast""|""ethan and hila""",721066,30576,1251,6114,https://i.ytimg.com/vi/cTBnDJ77kr0/default.jpg,FALSE,FALSE,FALSE,Thanks to Hila Klein for slammin with me this week!\nThanks to http://meundies.com/h3 & http://naturebox.com/h3 & http://h3h3shop.com for sponsoring us!\n\nMERCH... http://h3h3shop.com \n\nWatch LIVE every Friday at 3pm PST: https://www.twitch.tv/h3h3productions/\n\nITUNES -- https://goo.gl/desgTE\nGOOGLE PLAY MUSIC -- https://goo.gl/EnllKV\n\nTwitter...................... https://twitter.com/h3h3productions\nHila's Twitter............ https://twitter.com/hilakleinh3\nMERCH.................... http://h3h3shop.com\nInstagram................ http://instagram.com/h3h3productions\nHila's Instragram..... https://www.instagram.com/kleinhila\nWebsite.................... http://h3h3productions.com\nSubreddit................. http://reddit.com/r/h3h3productions\n \nPodcast Theme song by EchoRobot:\nhttps://soundcloud.com/aldenchambers/h3h3-podcast-theme-ft-nelward-and-custodian
FSdg3UVuBKE,17.14.11,Autumn's sick...,Sugar Pine 7,24,2017-11-13T03:08:01.000Z,"sugar pine 7|""steven suptic""|""autumn""|""sick""|""parker""|""vape""|""vapers""",182330,14901,55,1442,https://i.ytimg.com/vi/FSdg3UVuBKE/default.jpg,FALSE,FALSE,FALSE,She needs your prayers.\nNEW MERCH!\nhttps://store.roosterteeth.com/collections/sugar-pine-7\n\nSteve:\nhttps://twitter.com/StevenSuptic\n\nAutumn:\nhttps://twitter.com/_rufhaus?lang=en\n\nJames:\nhttps://twitter.com/jamesdeangeliz?lang=en\n\nCib:\nhttps://twitter.com/notCIB?lang=en\n\nElliott:\nhttps://twitter.com/ElliottcMorgan?lang=en\n\nParker:\nhttps://twitter.com/ParkerGames?lang=en\n\nJeremy:\nhttps://twitter.com/JeremySauder?lang=en\n\nClick to Subscribe and become just another cog in the machine:\nhttps://www.youtube.com/user/mlghwnt?sub_confirmation=1
6xT1Xc7_X3k,17.14.11,He Almost Died Pier Jumping ...,Danny Duncan,23,2017-11-12T22:55:07.000Z,"danny duncan|""danny duncan 69""|""kevin""|""danny duncan vlogs""|""danny duncan pranks""|""santa monica pier""|""jumping off santa monica pier""|""guy jumps off santa monica pier""|""pier jump fails""|""california""|""stunts""",524623,34460,237,2490,https://i.ytimg.com/vi/6xT1Xc7_X3k/default.jpg,FALSE,FALSE,FALSE,"Glad we're alive. Thanks for watching guys I love you!\n\nMerchandise ▶ http://DannyDuncan69.com\nTwitter ▶ http://www.twitter.com/DannyDuncan69\nInstagram ▶ http://www.instagram.com/DannyDuncan69\nFacebook▶ http://www.facebook.com/DannyDuncan69\nSnapchat ▶ http://snpcht.me/DannyDuncan69\n\nFan mail send to:\nDanny Duncan\nPO BOX 75252\nLos Angeles, CA 90020"
GBVxEpQr8R8,17.14.11,ON VOUS DÉVOILE NOTRE VRAI SALAIRE,Mcfly & Carlito,24,2017-11-12T08:59:25.000Z,"mcfly|""carlito""|""golden moustache""|""fatshow""|""badass""|""dab""|""j'effectue le dab""|""on appelle des gens au hasard""|""le meilleur jeu en voiture""|""mcfly et carlito""|""mcfly & carlito""|""concours d'anecdotes""",2340941,200598,6018,7575,https://i.ytimg.com/vi/GBVxEpQr8R8/default.jpg,FALSE,FALSE,FALSE,"Nouvelle vidéo tous les dimanches matins 10h. \nSouscrivez à un abonnement, on va se marrer.\n\nBravo Laink et Terra pour le million !!!\n\nINSTAGRAM\n★ https://www.instagram.com/rafcarlito\n★ https://www.instagram.com/levraimcfly\n\nFACEBOOK \n►https://facebook.com/raphaelcarlierakacarlito\n►https://www.facebook.com/mcflyofficiel\n\nTWITTER \n✔ https://twitter.com/levraimcfly\n✔ https://twitter.com/raphael_carlier\n\nSnap : tontonmcfly\n\nRetrouvez tous les superbes éléments de déco présents dans notre studio ici :\nhttp://bit.ly/MobilierIndusMcFlyEtCarlito\n\nBravo à Aurélien pour sa performance d'acteur digne de Wesley Snipes.\n\nAudrey, t'es la best. Genre vraiment. Et c'est trop bien quand tu imites le chat qui vomit.\n\nNyo : nous n'avons jamais été autant comblé par un homme.\n\nEt Lucas magistral en ouvrier du bâtiment.\n\nMot de Carlito.: pour ceux qui ont kiffé Sonic sur la box,  découvrez l'offre pass jeux famille orange, seulement 10 euros par mois par abonnement pour 200 jeux :\n\nhttp://www.passjeuxfamille.orange.fr/\n\nSully et Élise, on vous aime autant que vous vous aimez."
JwboxqDylgg,17.14.11,"Canada Soccer's Women's National Team v USA International Friendly LIVE from Avaya Stadium, San Jose",Canada Soccer,17,2017-11-13T05:53:49.000Z,[none],36311,277,28,13,https://i.ytimg.com/vi/JwboxqDylgg/default.jpg,FALSE,FALSE,FALSE,"Canada Soccer's Women's National Team face rivals USA in an International Friendly LIVE from Avaya Stadium, San Jose, California November 12, 2017"
t3FYESkzjUI,17.14.11,Emotionally Responsive Digital Human,Soul Machines,22,2017-10-31T01:11:48.000Z,"artificial intelligence|""digital human""|""virtual assistant""|""machine learning""|""technology""",3684,4,5,1,https://i.ytimg.com/vi/t3FYESkzjUI/default.jpg,FALSE,FALSE,FALSE,Soul Machines is making machines more human
0gLWN3uq74o,17.14.11,Ex-intelligence chiefs fire back at Trump criticism (Entire CNN interview),CNN,29,2017-11-12T15:36:51.000Z,"James Clapper|""John Brennan""|""President Trump""|""Russia""|""Vladimir Putin""|""jake tapper""|""sotu""|""DNI""|""director of national intelligence""|""russia meddling""",286231,2530,1127,3239,https://i.ytimg.com/vi/0gLWN3uq74o/default.jpg,FALSE,FALSE,FALSE,Former Director of National Intelligence James Clapper and former CIA Director John Brennan fired back at President Trump calling them and former FBI director James Comey political hacks and  addressed President Trump's comments on Russian interference in the 2016 US election.
9fNvbeBLwGc,17.14.11,HOLIDAY 2017 ⭐️ COLLECTION & SKIN FROST PALETTE REVEAL | Jeffree Star Cosmetics,jeffreestar,26,2017-11-12T17:51:45.000Z,"jeffree star|""jeffree star cosmetics""|""jeffree star approved""|""velour liquid lipstick""|""lip ammunition""|""jeffreey star holiday 17 collection""|""holiday liquid lipstick""|""jeffree star liquid lipstick""|""limited edition makeup""|""medua liquid lip""|""mermaind blood liquid lip""|""velour lip scrub""|""black friday sale""|""skin frost pro palette""|""skin frost reveal""|""holiday luxury makeup""|""manny mua""|""laura lee""|""james charles""|""tati westbrook""|""fenty beauty""|""kkw beauty review""",1637172,100779,989,18966,https://i.ytimg.com/vi/9fNvbeBLwGc/default.jpg,FALSE,FALSE,FALSE,"HEY EVERYONE!!!! ⭐️ Today I'm revealing my ENTIRE Holiday 2017 HOLIDAY COLLECTION!!!!!! I can't believe that my brand turns 3 YEARS OLD this month!!!!!!! Where does the time go??? For this years packaging, everything is FULL glitter and holographic!!!! I'm also introducing the Skin Frost™ Pro Palettes that come with 6 shades and are very travel friendly!!!! I hope you all love the shades! Sound off below and let me know your favorites!!!!!\n\nTHIS COLLECTION LAUNCHES ON NOV. 18!!!!!!! @ 10AM PST / 1PM EST!!!!!!! ** THERE WILL ALSO BE FREE SHIPPING  FOR ALL U.S CUSTOMERS \n\nVELOUR LIQUID LIPSTICK SHADES:\nMedusa - dark blue based grey\nPoinsettia - metallic bright red\nSanta Baby - dark red berry\nHuman Nature - deep mauve plum\nChristmas Cookie - soft matte brown\nMermaid Blood - dark teal\nBerries On Ice  - dark red based purple \nFirst Class - gold metallic\n\nLIP AMMUNITION™ SHADES:\nAllegedly - terra-cotta nude\nGargoyle - stone grey\nRedrum - the perfect red\nChampagne Tears - soft peach glitter\n\nSKIN FROST™ PRO PALETTES ($40):\nPLATINUM ICE \n24 KARAT \n\nVELOUR LIP SCRUBS:\nLemon Icebox Cookies\nCandy Cane\nMarshmellow\n\n💄*SHOP* THE BRAND NEW #JeffreeStarCosmetics FASHION ► http://bit.ly/2hP94cU\n\n*SHOP: http://www.jeffreestarcosmetics.com\n+ FOLLOW MY BRAND ON Instagram: http://instagram.com/jeffreestarcosmetics\n+FOLLOW ME ON IG: http://instagram.com/jeffreestar\n+ FACEBOOK: https://www.facebook.com/JeffreeStar\n+ SNAPCHAT: jeffreestar\n+ TWITTER: @jeffreestar\n\nJACKET BY: Balmain\n\nWATCH MORE VIDEOS...................❤️🔥\n\n💉 FULL FACE USING ONLY MAYBELLINE PRODUCTS! ► http://bit.ly/2rdsIjR\n\nFULL FACE USING ONLY E.L.F. PRODUCTS ► http://bit.ly/2jdIzNC\n\n🔮 WATCH ME COVER MY TATTOOS WITH MAKEUP! ► http://bit.ly/2mgmukb\n\n⚰️ WATCH ME REVIEW THE MOSCHINO + SEPHORA COLLECTION ► http://bit.ly/2w56KnB\n\nMUSIC: ► Inukshuk  ► ”The Long Road Home” - https://www.youtube.com/watch?v=athFRSHdrag\n (courtesy of NoCopyrightSounds)"
