video_id,trending_date,title,channel_title,category_id,publish_time,tags,views,likes,dislikes,comment_count,thumbnail_link,comments_disabled,ratings_disabled,video_error_or_removed,description
#NAME?,17.14.11,"Gerrymandering, Conservative Comedians, Bobby Kennedy | Overtime with Bill Maher (HBO)",Real Time with Bill Maher,1,2017-11-11T05:30:08.000Z,"DNC Chairwoman Donna Brazile|""Hacks""|""The Inside Story of the Break-ins and Breakdowns That Put Donald Trump in the White House""|""comedian""|""Sarah Silverman""|""I Love You""|""America""|""Hulu""|""Michael Moore""|""Broadway""|""The Terms of My Surrender""|""Chris Matthews""|""MSNBC""|""Hardball with Chris Matthews""|""Bobby Kennedy""|""A Raging Spirit""",458964,4903,392,1289,https://i.ytimg.com/vi/-Toujzk3ysk/default.jpg,FALSE,FALSE,FALSE,"Subscribe to the Real Time YouTube: http://itsh.bo/10r5A1B\n\nBill and his guests – Donna Brazile, Michael Moore, Chris Matthews, and Sarah Silverman – answer viewer questions after the show.\n\nConnect with Real Time Online:\nFind Real Time on Facebook: https://www.facebook.com/Maher\nFind Real Time on Twitter: https://twitter.com/RealTimers\nFind Real Time with Bill Maher Official Site: http://itsh.bo/HttKcM.\nFind Real Time with Bill Maher on HBO GO® http://itsh.bo/iioY87.\nFind Real Time with Bill Maher on Connect: http://connect.hbo.com/real-time-bill-maher\nFind Real Time on Instagram: http://instagram.com/realtimers\nThe Real Time blog: http://www.real-time-with-bill-maher-blog.com/\n\nIt's HBO.\n\nConnect with HBO Online\nFind HBO on Facebook: http://Facebook.com/HBO\nFollow @HBO on Twitter: http://Twitter.com/HBO\nFind HBO on Youtube: http://Youtube.com/HBO\nFind HBO Official Site: http://HBO.com\nFind HBO Connect: http://Connect.hbo.com\nFind HBO GO: http://HBOGO.com\nFind HBO on Instagram: http://Instagram.com/hbo\nFind HBO on Foursquare: http://Foursquare.com/hbo\n\nCheck out other HBO Channels\nHBO: http://www.youtube.com/hbo\nGame of Thrones: http://www.youtube.com/GameofThrones \nTrue Blood: http://www.youtube.com/trueblood \nHBO Sports: http://www.youtube.com/HBOsports \nHBO Documentary Films: http://www.youtube.com/HBODocs \nCinemax: http://www.youtube.com/Cinemax \nHBO Latino: http://www.youtube.com/HBOLatino"
k3GxDSG1c0Y,17.14.11,NELK - Before They Were Famous - Kyle Forgeard & Jesse Sebastiani,Michael McCrudden,24,2017-11-12T15:30:01.000Z,"nelk|""kyle forgeard""|""jesse sebastiani""|""nelk kyle""|""nelk jesse""|""nelk prank""|""nelk tv show""|""nelk youtube""|""kyle forgeard wiki""|""jesse sebastiani wiki""|""kyle forgeard age""|""jesse sebestiani age""|""jesse sebestiani youtube""|""kyle forgeard youtube""|""nelk before they were famous""|""before they were famous""|""nelk coke prank""|""nelk boys""|""kyle forgeard instagram""|""jesse sebastiani instagram""",172720,10736,236,3813,https://i.ytimg.com/vi/k3GxDSG1c0Y/default.jpg,FALSE,FALSE,FALSE,"NELK - Before They Were Famous - Kyle Forgeard & Jesse Sebastian\nBefore the boys of Nelk would have multiple videos go viral including their Pretending To Be A McDonald's Employee Prank, 7 Ways To Compliment Boobs and their Coke Prank on Cops video. Before the boys of Nelk would buddy up with Wolfie Raps and take a trip out to LA to hang with Faze Banks and Clout Gang. Before The Boys would get kicked off multiple University Campuses and be banned from filming their prank videos in Canada. Before Nelk surpassed 1 Million Subscrbers and would celebrate by cracking some cold ones and answering questions from their crazy supportive fans. Find out more about the boys come up in this video:\n\n=============================================\n\nSUBSCRIBE: http://www.youtube.com/MrMcCruddenMichael?sub_confirmation=1\n\n**** MORE VIDEOS YOU WILL LOVE **** \n\nRECENT UPLOADS:\nhttps://www.youtube.com/watch?v=aiTIUWu85Bg&list=PLXOk6VWlb9y3aYG75cOnxXIyVwNdN3HMX\n\nThe RICH Life VIDEOS:\nhttps://www.youtube.com/watch?v=aiTIUWu85Bg&list=PLXOk6VWlb9y3qLB5-gXZjnbYEsFSSIqVZ\n\nAFTER THEY WERE FAMOUS VIDEOS:\nhttps://www.youtube.com/watch?v=_f0-jz4AZB8&list=PLXOk6VWlb9y33jo7qHJF64zr2UlU7dKMb\n\n=============================================\n\n*** GRAB SOME 'Before They Were Famous' MERCH ***\nhttps://teespring.com/stores/before-they-were-famous\n\n=============================================\n\nNELK'S SOCIAL MEDIA LINKS:\n\nYOUTUBE CHANNEL:\nhttps://m.youtube.com/user/NelkFilmz\n\nNELK INSTAGRAM:\nhttps://www.instagram.com/nelkboys\n\nKYLE INSTAGRAM:\nhttps://www.instagram.com/kyleforgeard\n\nJESSE INSTAGRAM:\nhttps://www.instagram.com/mtvjesse\n\n=============================================\n\nMcCrudden's SOCIAL MEDIA LINKS:\n\nYOUTUBE:\nhttp://www.youtube.com/MrMcCruddenMichael\n\nINSTAGRAM: \nhttp://www.Instagram.com/McCruddenM\n\nTWITTER: \nhttp://www.Twitter.com/McCruddenM\n\nFACEBOOK:\n https://www.facebook.com/Michael-McCrudden-1649360785312596/\n\n=============================================\n\nCREDITS:\nPRODUCER: Matt Rubel, Question Time\nhttps://www.youtube.com/QuestionTimeQT\n\nEDITOR: Keval Prajapati\nhttps://www.youtube.com/user/KevalProduction\n\n=============================================\n\nWe strive for accuracy and fairness. If you see something that doesn't look right contact McCrudden: http://www.Twitter.com/McCruddenM\n\nSUBSCRIBE: http://www.youtube.com/MrMcCruddenMichael?sub_confirmation=1"
ThLVteoxnSE,17.14.11,"LFR11 - Game 19 - B Sweeper - Tor 4, Bos 1",SteveDangle,17,2017-11-12T21:11:04.000Z,"Toronto Maple Leafs|""Maple Leafs""|""Leafs""|""Boston Bruins""|""Morgan Rielly""|""James van Riemsdyk""|""Mitch Marner""|""Curtis McElhinney""|""Steve Dangle""",28992,1409,9,188,https://i.ytimg.com/vi/ThLVteoxnSE/default.jpg,FALSE,FALSE,FALSE,"And it stayed 4-1, the way it always should have been.\nHHOF Article: http://www.sportsnet.ca/hockey/nhl/patrick-marleau-timer-comes-game-winning-goals/\nBerkshire on the Leafs: http://www.sportsnet.ca/hockey/nhl/examining-maple-leafs-fast-start-cold-streak/"
exMNBvwCfRY,17.14.11,LES PIRES DOUBLAGES FRANÇAIS,SQUEEZIE,23,2017-11-10T18:25:25.000Z,"squeezie doublage|""squeezie batman""|""squeezie doublage dragon ball""|""squeezie doublage animés""|""squeezie vidéo doublage""|""squeezie voix francaises""",3641421,218587,5809,12649,https://i.ytimg.com/vi/exMNBvwCfRY/default.jpg,FALSE,FALSE,FALSE,"Quand la voix ne colle pas au perso, que la traduction n'est pas bonne ou que le jeu d'acteur est mauvais : le plaisir est intense\nABONNE-TOI ! http://bit.ly/2fm88Xo (merci)\nLa boutique officielle : http://www.squeezie.fr\n\nTwitter ► http://www.twitter.com/xSqueeZie\nFacebook ► http://www.facebook.com/SqueeZiePageOfficielle\n\nRègles de l'espace commentaire (à respecter sous peine d'être banni par l'équipe de modération) :\n\n- Écrire dans un français correct\n- Respecter les autres\n- Pas de commentaires putalike (like si tu regardes la vidéo en chaussettes par exemple)\n- Pas de pubs et de spams"
c64I9HNpiOY,17.14.11,Padmavati : Ek Dil Ek Jaan Video Song | Deepika Padukone | Shahid Kapoor | Sanjay Leela Bhansali,T-Series,10,2017-11-11T06:14:19.000Z,"Ek Dil Ek Jaan Video Song|""'Ek Dil Ek Jaan'""|""Ek Dil Ek Jaan Video""|""Padmavati""|""Padmavati songs""|""Padmavati movie song""|""deepika padukone""|""ranveer singh""|""ghoomar""|""padmavati song""|""Deepika Padukone""|""Shahid Kapoor""|""Sanjay Leela Bhansali""|""Padmavati Deepika Padukone""|""Ghoomar""|""Ghoomar Deepika Padukone""|""Padmavati Songs""|""new hindi songs""|""hindi songs""|""shahid kapoor""|""sanjay leela bhansali""|""indian songs""|""padmavati songs""|""love song""|""love song 2017""|""do dil ek jaan""",10588371,132738,8812,10847,https://i.ytimg.com/vi/c64I9HNpiOY/default.jpg,FALSE,FALSE,FALSE,"Presenting the song 'Ek Dil Ek Jaan' from Padmavati in the voice of Shivam Pathak, Music by Sanjay Leela Bhansali and Lyrics by A M Turaz.  \n\nPadmavati starring Ranveer Singh, Deepika Padukone, Shahid Kapoor, Aditi Rao Hydari and Jim Sarbh. Directed by Sanjay Leela Bhansali and Produced by Viacom18 Motion Pictures and Bhansali Productions, is slated to release on 1st December 2017.\n\n♪ Available on ♪\niTunes : http://bit.ly/Ek-Dil-Ek-Jaan-iTunes\nHungama : http://bit.ly/Ek-Dil-Ek-Jaan-Hungama\nSaavn : http://bit.ly/Ek-Dil-Ek-Jaan-Saavn\nGaana : http://bit.ly/Ek-Dil-Ek-Jaan-Gaana\nApple Music : http://bit.ly/Ek-Dil-Ek-Jaan-Apple-Music\nGoogle Play : http://bit.ly/Ek-Dil-Ek-Jaan-Google-Play\n\nSong Credits :\n♪Song: Ek Dil Ek Jaan\n♪Singer: Shivam Pathak\n♪Music: Sanjay Leela Bhansali\n♪Lyrics:  A M Turaz\n♪Music Label: T-Series\n♪Song Produced: Sanchit Balhara,\n♪Qawwali Singers: Mujtaba Aziz Naza, Kunal Pandit, Farhan Sabri\n♪Songs Recorded, Mixed & Mastered: Tanay Gajjar at Flutter Studio.\n♪Assisted: Rupak Thakur\n___\nEnjoy & stay connected with us!\n► Subscribe to T-Series: http://bit.ly/TSeriesYouTube\n► Like us on Facebook: https://www.facebook.com/tseriesmusic\n► Follow us on Twitter: https://twitter.com/tseries\n► Follow us on Instagram: http://bit.ly/InstagramTseries"
oo_xQyxgNpg,17.14.11,蒙面唱将猜猜猜第二季 EP10 Ella抛媚眼狂撩侦探奥特曼 171112,蒙面唱将猜猜猜2重磅归来,22,2017-11-12T15:46:02.000Z,"蒙面唱将猜猜猜第二季|""江苏卫视""|""灿星制作""|""真人秀""|""音乐""|""综艺""|""陶晶莹""|""陈嘉桦""|""大张伟""|""巫启贤""|""李响""|""张智霖""|""黄晓明""|""范玮琪""|""成方圆""|""李荣浩""|""林俊杰""|""郑恺""|""黎明""|""陶喆""|""周传雄""|""萱萱""|""吉克隽逸""|""杜德伟""|""马丽""|""苏慧伦""|""刘维""|""李慧珍""|""薛之谦""|""汪苏泷""|""孙杨""|""黄丽玲""|""周笔畅""|""陈洁仪""|""腾格尔""|""陈梓童""|""雪村""|""霍尊""|""GAI""|""斯琴 格日乐""|""常石磊""|""潘粤 明""|""taojingying""|""Ella""|""dazhangwei""|""zhangzhilin""|""huangxiaoming""|""fanweiqi""|""chengfangyuan""|""lironghao""|""linjunjie""|""zhengkai""|""liming""|""taozhe""|""zhouchuanxio ng""|""xuanxuan""|""dudewei""|""jikejunyi""|""mali""|""suhuilun""|""liuwei""|""lihuizhen""|""xuezhiqian""|""wnagsulong""|""sunyang""|""huangliling""|""zhoubichang""|""chenjieyi""|""tenggeer""|""c henzitong""|""xuecun""|""huozun""",268111,447,100,240,https://i.ytimg.com/vi/oo_xQyxgNpg/default.jpg,FALSE,FALSE,FALSE,【欢迎订阅蒙面唱將猜猜猜YouTube频道】\nhttps://goo.gl/h44LpF\n\n《蒙面唱将猜猜猜第二季》在玩法和嘉宾阵容较上一季都有了进一步升级。陶晶莹、巫启贤、Ella、大张伟将以老朋友的身份再度加盟，还会融入《跨界\n\n歌王》的元素，邀来演艺界、曲艺界、文艺界和体育界的实力唱将跨界加盟。在保留熟悉“配方”之\n\n外，猜评团迎来了重大升级，九位成员每期都有新面孔，还特别加入一位神秘大咖成为“飞行猜评员”……\n\n★《蒙面唱将猜猜猜》第二季重磅来袭 赛制升级听歌猜人更难【欢迎订阅】\nhttps://goo.gl/A9g7ZK\n\n★《蒙面唱将猜猜猜》第一季完整版【欢迎订阅】\nhttps://goo.gl/YVBQH5\n\n★國內首檔EDM音樂節目《蓋世英雄》——王力宏、鳥叔綜藝首秀 鄧紫棋強勢加盟【歡迎訂閱】\nhttps://goo.gl/Z7voB9\n\n★《一路上有你》第二季——张智霖袁咏仪再加盟 三位老公“造反”组不怕老婆联盟 【欢迎订阅】\nhttps://goo.gl/JAOkEm\n\n★《出发吧爱情》—— “全能好丈夫”吴京户外生存技能获赞 戚薇李承铉花式秀恩爱【欢迎订阅】\nhttps://goo.gl/N8ZBJ
teXaL6GdQRk,17.14.11,STRANGER JOKES : Jokes de Papa avec les teens de Stranger Things,"Le Jeu, C'est Sérieux",23,2017-11-13T15:48:57.000Z,"Stranger Jokes|""Jokes de Papa""|""Stranger Things""|""Charlie Heaton""|""Natalia Dyer""|""Joe Keery""|""Drôle""|""Humour""|""Blagues nulles""|""Dad Jokes""|""Netflix""|""Demogorgon""|""Onze""|""Eleven""|""Will""|""Joyce""|""Jonathan""|""Nancy""|""Steve""|""Paris Games Week""|""Try Not To Laugh""|""Try Not To Cringe""|""Essaye de ne pas rire""|""JeuSerieux""|""France""|""Québec""",141253,14354,202,417,https://i.ytimg.com/vi/teXaL6GdQRk/default.jpg,FALSE,FALSE,FALSE,"Contenu commandité par Netflix France.\nInspiré de Dads Jokes (All Def Digital) et Jokes de Papa (GaboomFilms).\n\nChose étrange pour Guiz et Laurent d'affronter les teens de Stranger Things – Charlie Heaton, Natalia Dyer et Joe Keery – dans un Jokes de Papa en marge de la Paris Games Week. Quelle équipe craquera sous la pression face à des blagues aussi nulles?\n\nSaison 2 de Stranger Things :\n▶ https://youtube.com/watch?v=JSQToYeeR4E\n\nDad Jokes de All Def Digital :\n▶ https://youtube.com/AllDefDigital\n\nJokes de Papa de GaboomFilms :\n▶ https://youtube.com/playlist?list=PLKVHXumEUNS53qA3_GkAlR9eMsHkMfsek\n\nNOTRE BOUTIQUE : http://society6.com/jeuserieux\nFACEBOOK : http://facebook.com/jeuserieux\nABONNEZ-VOUS : http://bit.ly/jeuserieux"
0kErOtN3q_w,17.14.11,WOW NAPAKAHUSAY ! DUTERTE AT TRUMP NAPAHANGA SA MGA BIGATING SINGING ARTIST KUMANTA SA 31st ASEAN,DUTERTE NEWS REPORT,25,2017-11-12T14:58:51.000Z,"Duterte News Report|""Philippines News Cast""|""Trending News Cast""|""Philippines Politics""|""Viral News Cast""|""PH News""|""Duterte News Cast""|""Balita Pilipinas""|""Balita News Cast""|""Philippine News Politics""|""President Rody Rodrigo Duterte""|""WOW NAPAKAHUSAY""|""BIGATING MGA SINGING ARTIST KUMANTA""|""31st ASEAN SUMMIT 2017""|""DUTERTE AT TRUMP NAPAHANGA""",234983,2358,125,344,https://i.ytimg.com/vi/0kErOtN3q_w/default.jpg,FALSE,FALSE,FALSE,"WOW NAPAKAHUSAY ! DUTERTE AT TRUMP NAPAHANGA SA MGA BIGATING SINGING ARTIST KUMANTA SA 31st ASEAN SUMMIT 2017\n\nPLEASE VISIT ➡ http://bit.ly/DuterteNewsReport\nFB ➡ http://facebook.com/Pres.RodyDuterte\nTwitter ➡ https://twitter.com/DuterteNewsCast\nGoogle+ ➡ http://plus.google.com/114099669253607137181\n\nDISCLAIMER:\n(NO COPYRIGHT INTENTIONS, FOR SUPPORT AND EDUCATIONAL PURPOSES ONLY)"
TaTleo4cOs8,17.14.11,SHOPPING FOR NEW FISH!!!,The king of DIY,15,2017-11-12T18:30:01.000Z,"shopping for new fish|""new fish""|""aquarium fish""|""aquarium""|""uarujoey""|""king of diy""|""aquarium gallery""|""the king of diy""|""fish tank""|""fish (animal)""|""diy king""|""arowana""|""flower horn""|""fish""",207532,7473,246,2120,https://i.ytimg.com/vi/TaTleo4cOs8/default.jpg,FALSE,FALSE,FALSE,"Today we go shopping for new fish for some of the aquariums. I wanted to find some asian type fish for the new asian based aquarium... but had no luck. I did however find other fish i just had to have... of course. lol\n\nDetails of store and buying tickets:\n\nBuy tickets in store:\n75 Macdonald Ave\nDartmouth, Nova Scotia\nOR\nCall to buy: \n1 - (902) - 446-3474\nOR buy online here: https://goo.gl/4BaMqb\n\nTickets are $10 each\nDraw will be Dec 3rd by Jeff in store(store owner) \n\n3rd will get a $200 store voucher \n2nd will get a $300 store voucher \n1st will get a 1/2 day trip to the King of DIY Gallery and dinner. \nWinner will be picked up by Jeff at the store. Date of tour will likely be the following Friday or Saturday. \n\nSUBSCRIBE ► https://goo.gl/xjOm50\nGet the ultimate DIY book ►  http://thekingofdiy.com\nLIMITED EDITION SHIRTS!! ► https://goo.gl/E2l6tk\nFacebook ► http://facebook.com/uarujoey\nInstagram ► https://www.instagram.com/uarujoey/\n\nThe king of DIY aquarium projects, education and inspiration!\n\nJoin me each SUNDAY, TUESDAY AND THURSDAY for a new aquarium related video!\n\nMAIL TO:\nPO BOX 25054\nTruro, NS\nB2N 7B8\nCanada\n\nHow to build aquariums: https://goo.gl/gu3CsK\nHow to build aquarium filters: https://goo.gl/cw0Jl9\nHow to build aquarium stands: https://goo.gl/9JB9jo\nHow to build aquarium equipment: https://goo.gl/BHkT2s\nHow to build aquarium lighting: https://goo.gl/Wg4kt0\nHow to build aquarium decorations: https://goo.gl/crQkeT\nVarius aquarium tutorials: https://goo.gl/BKCb3a\nALL Thursday videos: https://goo.gl/DPHjEM\nALL Sunday videos: https://goo.gl/Rn0wmS\n\n\nMy aquarium pumps, circulation and lights are by: http://ecotechmarine.com\nMy aquarium racks and the aquariums within them were made by: http://customaquariums.com"
Nc0ZCtZdgAk,17.14.11,KOKE (Full Video) | SUNANDA SHARMA | Latest Punjabi Songs 2017 | AMAR AUDIO,Amar Audio,10,2017-11-13T12:43:11.000Z,"Koke|""Koke Sunanda Sharma""|""Latest Punjabi Songs""|""New Punjabi Songs""|""Koke Punjabi Song""|""Punjabi Songs""|""Sunanda Sharma Punjabi Song""|""Sunanda Sharma New Songs""|""Sunanda Sharma Songs""|""Sunanda Sharma Koke""",628340,37121,2100,1667,https://i.ytimg.com/vi/Nc0ZCtZdgAk/default.jpg,FALSE,FALSE,FALSE,"Pinky Dhaliwal Presents New Punjabi Song KOKE in the voice of Blockbuster Queen SUNANDA SHARMA, Lyrics Penned down by SANGDIL 47, Music by GAGS2UDIOZ, Video by RIMPY PRINCE.\n\nENJOY...... LIKE | COMMENT | SHARE \n\nListen Full Audio on Gaana : https://gaana.com/song/koke-3\n\nSONG CREDIT : ☟ \n\nSong ➤ KOKE\nArtist ➤ Sunanda Sharma\n(https://www.facebook.com/SunandaSharmaOfficial)\nLyricist ➤ Sangdil 47\nMusic ➤ GagStudioz\nMix & Mastering ➤ Sameer Charegaonkar\nA Film by ➤ Rimpy Prince\nTeam Amar Audio ➤ Pardeep Sharma, Sandeep Joshi, Harpreet Harry, Preet Kalsi, Amninder Grewal, Neeru Chopra, Jyoti Dhaliwal\nCopyright ➤ MAD4MUSIC\nOnline Promotion - Gold Media\n\nProducer ➤ Pinky Dhaliwal\n(https://www.facebook.com/pinky.dhaliwal2)\n\nLabel ➤ Amar Audio\n(https://www.facebook.com/AmarAudio)\n\n✯✯✯✯✯✯✯✯✯✯✯✯✯✯✯✯✯✯✯✯✯✯✯✯✯✯✯✯✯✯✯✯✯✯✯✯\n\n Join Our Others Social Networks :☟\n☞Circle us on G+ : http://www.google.com/+amaraudiomusic\n☞Follow on Twitter : https://twitter.com/AmarAudio\n☞Linkedin : https://www.linkedin.com/in/amaraudio\n☞Instagram : https://instagram.com/amaraudio"
9t9u_yPEidY,17.14.11,"Jennifer Lopez - Amor, Amor, Amor (Official Video) ft. Wisin",JenniferLopezVEVO,10,2017-11-10T15:00:00.000Z,"Jennifer Lopez ft. Wisin|""Jennifer Lopez ft. Wisin Music""|""Jennifer Lopez ft. Wisin Official Video""|""Jennifer Lopez ft. Wisin Video""|""Jennifer Lopez ft. Wisin Video Oficial""|""Jennifer Lopez ft. Wisin Nuevo Video""|""Jennifer Lopez ft. Wisin New Video""|""Amor""|""Amor Official Video""|""Official Video""|""Amor Single""|""Single""|""Jennifer Lopez ft. Wisin New Single""|""Jennifer Lopez ft. Wisin Single""|""Jennifer Lopez ft. Wisin Amor""|""Jennifer""|""Lopez""",9548677,190085,15015,11473,https://i.ytimg.com/vi/9t9u_yPEidY/default.jpg,FALSE,FALSE,FALSE,"Jennifer Lopez ft. Wisin - Amor, Amor, Amor (Official Music Video)\n“Amor, Amor, Amor” is available on these digital platforms!\niTunes: http://smarturl.it/AAAi\nApple Music: http://smarturl.it/AAAap\nSpotify: http://smarturl.it/AAAs\nAmazon Music: http://smarturl.it/AAAam\nGoogle Play: http://smarturl.it/AAAgp\nVideo: http://smarturl.it/AAAv\nLinkfire: https://SML.lnk.to/AAA\n\nFollow JLO!\nOfficial Site: http://www.jenniferlopez.com\nFacebook: https://www.facebook.com/jenniferlopez\nInstagram: https://www.instagram.com/jlo\nTwitter: https://twitter.com/jlo\nOfficial music video by Jennifer Lopez ft. Wisin performing Amor, Amor, Amor. (C) 2017 Sony Music Entertainment US Latin LLC"
ebztEUmhEMY,17.14.11,Celebs You Didn't Know Passed Away,Grunge,24,2017-11-10T17:00:07.000Z,"stars passed|""stars passed away""|""stars lost""|""celebs passed""|""celebs passed away""|""celebs lost""|""stars we lost""|""celebs we lost""|""celebrities passed""|""celebrities passed away""|""celebrities lost""|""celebrities we lost""|""celebrity we lost""|""celebs gone""|""celebrities gone""|""celebrity gone""|""celebrities no longer here""|""celebs no longer here""|""celebrity no longer here""|""stevie ryan""|""craig sager""|""ray combs""|""talia joy""|""tv stars lost""|""movie stars lost""|""tv stars passed""",900014,3273,1189,721,https://i.ytimg.com/vi/ebztEUmhEMY/default.jpg,FALSE,FALSE,FALSE,"If you're new, Subscribe! → http://bit.ly/Subscribe-to-Grunge\nLearn more about celebs that passed →  https://youtu.be/ESnyPGOt034\n\nWhen worldwide superstars like David Bowie or Carrie Fisher pass away, their loss dominates the news cycle for days. But for other celebrities, sadly, the spotlight doesn't linger so long. In fact, it's possible you may not have even heard that some of your favorite stars are no longer with us. Here's a look at some celebrities you didn't know had passed away…\n\nRobert Guillaume | 0:20\nFats Domino | 0:50\nOmar Sharif | 1:19\nAmanda Peterson | 1:50\nCraig Sager | 2:19\nGlenn Quinn | 2:58\nGeorge Martin | 3:26\nRob Knox | 4:04\nManute Bol | 4:35\nWindell Middlebrooks | 5:21\nHector Camacho | 5:58\nStevie Ryan | 6:34\nKirby Puckett | 7:09\nZsa Zsa Gabor | 7:34\nDavid Graf | 8:08\nRay Combs | 8:39\nTalia Joy Castellano | 9:15\nMonty Hall | 9:57\nRod Taylor | 10:31\nSteven Hill | 11:03\n\nRead more here → http://www.grunge.com/27314/stars-may-know-dead/\n\nMovie Lists and Features\nhttps://www.youtube.com/playlist?list=PLbvw8GqH5MenVjgzP1H8WntGWin3JlAan\n\nBig Questions We Still Have After Watching Rogue One\nhttps://www.youtube.com/watch?v=ltcscK6YjNc&index=1&list=PLbvw8GqH5MenVjgzP1H8WntGWin3JlAan\n\nActors Whose Careers Were Almost Ruined By One Terrible Role \nhttps://www.youtube.com/watch?v=PnedfkujlDQ&index=2&list=PLbvw8GqH5MenVjgzP1H8WntGWin3JlAan\n\nMarvel Superheroes That Won't Survive Avengers: Infinity War\nhttps://www.youtube.com/watch?v=IfHVlnA-tnY&index=3&list=PLbvw8GqH5MenVjgzP1H8WntGWin3JlAan\n\nThe Ashton Kutcher Curse No One Seems to Notice\nhttps://www.youtube.com/watch?v=84XUI8Ch1mQ&index=4&list=PLbvw8GqH5MenVjgzP1H8WntGWin3JlAan\n\nThe Long List Of Stars Who Strangely Passed Away At Age 27\nhttps://www.youtube.com/watch?v=LQyYreS-Wv0&index=7&list=PLbvw8GqH5MenVjgzP1H8WntGWin3JlAan\n\nThe Untold Truth Of Steven Seagal\nhttps://www.youtube.com/watch?v=VTALSrugs1o&index=6&list=PLbvw8GqH5MenVjgzP1H8WntGWin3JlAan\n\nWebsite → http://www.grunge.com/\nLike us → https://www.facebook.com/GrungeHQ/\nInstagram → https://www.instagram.com/grungehq/\n\nThe world is pretty weird...in fact, it's a whole lot weirder than you think. If you haven't learned something new today, you're missing out. Grunge is the place to immerse yourself in fun facts and cool tidbits on history, entertainment, science, and plenty more. It's just like reading books...but exciting!"
MLQLOOUO84Y,17.14.11,《猎场》第15、16、17、18集最全预告集合：夏部长下马，罗伊人投靠郑秋冬。郑秋冬熊青春办结婚证,Hong mei li,24,2017-11-13T16:23:39.000Z,"热播剧、剧透、预告、胡歌、陈龙、孙红雷、张嘉译、祖峰、胡兵、菅纫姿、万茜、郑秋冬、刘量体、林拜、曲闽京、熊青春、獵場、Game|""Of""|""Hunting""|""、孫紅雷、張嘉譯""",25863,32,3,13,https://i.ytimg.com/vi/MLQLOOUO84Y/default.jpg,FALSE,FALSE,FALSE,《猎场》官方播放頻道欢迎大家订阅观看大剧独播 ：https://www.youtube.com/channel/UCNORTw_uosRNGgdEjwdHvuw\n点击观看播放列表：https://www.youtube.com/playlist?list=PLkvG4EWPDB0mKweR_WQL6E-jaBmAQ0Qzf\n\n本频道无意侵权版权※ 如有侵犯请来信告之【立即秒删】\n专注搜集中国大陆热播剧【剧透、花絮、新闻】\n秒速更新【下集预告】※ 追剧无忧※欢迎订阅
9B-q8h31Bpk,17.14.11,John Oliver Tackles Louis C.K. And Donald Trump In Season Finale Featuring Tom Hanks,TV Shows,22,2017-11-13T04:49:26.000Z,[none],106029,1270,101,181,https://i.ytimg.com/vi/9B-q8h31Bpk/default.jpg,FALSE,FALSE,FALSE,"John Oliver on News, Politics ..."
hW2B_GT3b1E,17.14.11,How green delegates keep warm at UN Climate Change Conference,Rebel Media,25,2017-11-13T11:21:32.000Z,"news|""Rebel Media""|""RebelMedia""|""UN""|""Climate Change Conference""|""COP23""|""fossil fuels""|""green""|""global warming""",11636,1375,20,281,https://i.ytimg.com/vi/hW2B_GT3b1E/default.jpg,FALSE,FALSE,FALSE,"Sheila Gunn Reid of TheRebel.media: While UN Climate Change Conference delegates are deciding how to make you cut back on fossil fuels, they're keeping warm like this... http://www.RebelUN.com\nPS: Get EARLY access to Sheila Gunn Reid's reports, PLUS shows hosted by Tommy Robinson, Ezra Levant and MORE when you JOIN: http://www.TheRebel.media/Shows\n\n***\nCredits:\n\nCircus Waltz - Silent Film Light by Kevin MacLeod is licensed under a Creative Commons Attribution license (https://creativecommons.org/licenses/by/4.0/)\n\nSource: http://incompetech.com/music/royalty-free/index.html?isrc=USUAN1100291\n\nArtist: http://incompetech.com/"
0PkVodF5QQ8,17.14.11,"Valérie Plante, la première mairesse de Montréal à Tout Le Monde En Parle TLMEP",mart lat,24,2017-11-13T02:17:01.000Z,"Valérie Plante|""mairesse""|""Montréal""|""Tout Le Monde En Parle""|""tlmep""|""maire""",9368,75,15,28,https://i.ytimg.com/vi/0PkVodF5QQ8/default.jpg,FALSE,FALSE,FALSE,"La première mairesse de Montréal, Valérie Plante, n’a pas que son sourire comme atout pour faire de Montréal une ville à échelle humaine. Pour l’élue, qui a fait campagne avec des idées progressistes sur la mobilité, le transport et la décentralisation des pouvoirs, cette élection démontre que les Montréalais ont à cœur leur milieu de vie. Même s’il n’y a pas de révolution qui se dessine, l’Hôtel de Ville verra arriver des idées neuves et un nouveau dialogue avec les citoyens, tandis que le centre-ville pourra dire adieu à la course de formule E…"
